{
  "schemaVersion": "8.0",
  "meta": {
    "topic": "电灯为什么会发光",
    "question": "电灯为什么会发光？",
    "slug": "bulb-glow",
    "summary": "沿着白炽灯的一束光，逐层追问为什么：热从哪里来，电子为什么移动，电压又从哪里来。",
    "category": "物理 · 电学",
    "estimatedMinutes": 10,
    "language": "zh-CN",
    "asOf": "2026-10-27",
    "audience": "知道灯泡会亮，但不清楚电、热和光如何连接的普通学习者",
    "evidenceGaps": [
      "本页讨论依靠灯丝高温发光的白炽灯，不展开 LED 的电子—空穴复合。",
      "白炽灯会同时发出红外线和可见光；本页聚焦“电能如何变成可见光”的主因果链。",
      "热力学和量子化学能继续解释自由能为何降低，但已超出这条日常因果链的简明范围。"
    ],
    "learningLevel": "middle"
  },
  "center": {
    "id": "root",
    "question": "电灯为什么会发光？",
    "summary": "按下开关后，电能并没有直接变成光。白炽灯先把灯丝加热，炽热的灯丝再发出热辐射，其中一部分落在人眼可见的波段。",
    "insight": "先看见“灯丝发热”这一中间现象，再沿热量、电子运动和电压继续向下追问，才能得到一条连续因果链，而不是几个互不相连的知识点。",
    "tags": [
      "白炽灯",
      "热辐射",
      "因果链"
    ],
    "overviewVisual": {
      "kind": "image",
      "src": "media/bulb-glow/overview.svg",
      "alt": "白炽灯因果总览：电池维持电压，电场推动电子，电子碰撞让灯丝发热，热辐射中包含可见光",
      "caption": "一张图串起整条因果链：化学能 → 电压 → 电子漂移 → 发热 → 热辐射 → 可见光。"
    },
    "analogy": {
      "title": "把整条电路想成一条环形水路",
      "scene": "水泵把水推上高处，形成压力差；水沿粗细不同、内壁粗糙的管子绕一圈，最后回到水泵。",
      "mappings": [
        {
          "familiar": "水泵",
          "concept": "电源"
        },
        {
          "familiar": "两端的水压差",
          "concept": "电压"
        },
        {
          "familiar": "沿管流动的水",
          "concept": "电流"
        },
        {
          "familiar": "又窄又粗糙的管段",
          "concept": "灯丝"
        }
      ],
      "limit": "水管里是水在整体移动；电路靠电场推动电荷，单个电子并不会从电池瞬间跑到灯泡。",
      "visual": {
        "kind": "manim",
        "sceneSource": "media/bulb-glow/water-circuit-analogy.py",
        "sceneClass": "WaterCircuitAnalogy",
        "videoSrc": "media/bulb-glow/water-circuit-analogy-output/water-circuit-analogy.webm",
        "posterSrc": "media/bulb-glow/water-circuit-analogy-output/water-circuit-analogy.webp",
        "durationSeconds": 10.1,
        "alt": "水路类比：水泵维持压差，水沿闭合管道流动，经过窄管段时发热",
        "caption": "水泵、水压差和狭窄管道分别帮助理解电源、电压和灯丝发热；水本身不是电荷。",
        "transcript": [
          {
            "start": 0.0,
            "end": 1.5,
            "text": "先把电路想成一条闭合水路。"
          },
          {
            "start": 1.5,
            "end": 3.2,
            "text": "水泵持续维持两端压差，让水沿管子循环。"
          },
          {
            "start": 3.2,
            "end": 5.2,
            "text": "水流经过又窄又粗糙的管段时，阻力让管壁升温。"
          },
          {
            "start": 5.2,
            "end": 8.0,
            "text": "类比只借用水泵、压差和流动关系，水本身并不是电荷。"
          }
        ],
        "fallbackSvg": "<svg xmlns='http://www.w3.org/2000/svg' viewBox='0 0 800 450'><rect width='800' height='450' rx='28' fill='#f4fbf7'/><rect x='130' y='128' width='540' height='210' rx='42' fill='none' stroke='#b7d8e8' stroke-width='24'/><text x='400' y='80' text-anchor='middle' fill='#285d4b' font-size='27' font-family='sans-serif'>水路类比：泵维持压差，窄管发热</text><text x='400' y='410' text-anchor='middle' fill='#5c6b63' font-size='18' font-family='sans-serif'>水本身不是电荷，类比只借用流动关系</text></svg>"
      }
    }
  },
  "nodes": [
    {
      "id": "incandescence",
      "parentId": "root",
      "type": "phenomenon",
      "question": "灯泡接通电源后，为什么灯丝会热到发光？",
      "label": "先发热，再发光",
      "answer": "电流在灯丝中耗散能量，使灯丝升温；温度足够高时，热辐射中可见光的比例才变得明显。",
      "summary": "白炽灯的关键中间现象是高温。电能首先变成灯丝的内能，灯丝温度升高后才出现足够强的可见热辐射。",
      "nextQuestion": "为什么热的灯丝会发出可见光？",
      "knowledge": "白炽灯把钨丝加热到白炽状态，利用高温物体的热辐射照明。电能并不会在导线中直接变成一束光；它先提高灯丝温度，再由灯丝向外辐射能量。温度越高，辐射总功率越大，辐射谱也越向短波方向移动，因此可见光所占比例会提高。",
      "facts": [
        "白炽灯通过加热灯丝到白炽状态而发光，并非让电流直接发射可见光。",
        "灯丝温度越高，热辐射越强，且辐射谱峰值向更短波长移动。",
        "白炽灯的大部分输入能量会变成热，只有一部分成为可见光，因此照明效率有限。"
      ],
      "tags": [
        "白炽灯",
        "灯丝",
        "热辐射"
      ],
      "analogy": {
        "title": "水流挤过狭窄管段后发热",
        "scene": "水流被迫通过一段又窄又粗糙的管子，摩擦和碰撞把有方向的流动变成管壁的热。",
        "mappings": [
          {
            "familiar": "水流携带的能量",
            "concept": "电能"
          },
          {
            "familiar": "窄管的阻力",
            "concept": "灯丝电阻"
          },
          {
            "familiar": "管壁升温",
            "concept": "灯丝温度升高"
          },
          {
            "familiar": "灼热管道发红发亮",
            "concept": "炽热灯丝发出可见光"
          }
        ],
        "limit": "普通水管受热也不会发出足够的光；白炽灯靠数千开尔文的热辐射发光，并非摩擦产生火花。",
        "visual": {
          "kind": "image",
          "src": "media/bulb-glow/narrow-pipe-analogy.svg",
          "alt": "水流穿过狭窄管段，摩擦与碰撞让管壁升温",
          "caption": "窄管提高阻力，水流的有序能量转成管壁的热。"
        }
      },
      "visual": {
        "kind": "image",
        "src": "media/bulb-glow/incandescence.svg",
        "alt": "白炽灯灯丝发光，并标出电能、焦耳热、热辐射和可见光的转换关系",
        "caption": "灯丝先被电流加热，热辐射中只有一部分落在人眼可见的波段。"
      },
      "experiment": {
        "title": "调光观察颜色变化",
        "steps": [
          "在安全条件下使用可调光白炽灯，从较暗档位逐步调亮。",
          "观察灯丝颜色如何由暗红、橙红变化到更接近白色。",
          "不要直接注视强光；只比较颜色趋势，不把视觉判断当作精确温度测量。"
        ]
      },
      "videoLinks": [
        {
          "id": "incandescence-video-1",
          "title": "热辐射光源（白炽灯和卤钨灯），开关频繁寿命短，不允许频闪。",
          "url": "https://www.bilibili.com/video/BV1F94y1f7VJ",
          "embedUrl": "https://player.bilibili.com/player.html?bvid=BV1F94y1f7VJ&page=1&autoplay=0",
          "platform": "bilibili",
          "author": "123职业学院",
          "thumbnailUrl": "https://i1.hdslb.com/bfs/archive/65794231045c69825391cf13bb28693d8388881d.jpg",
          "durationSeconds": 68,
          "publishedAt": "2022-03-26",
          "queryDate": "2026-10-26",
          "relevanceScore": 61.0,
          "selectionRationale": "直接说明白炽灯属于热辐射光源，适合建立“先发热、再发光”的第一层因果。"
        }
      ]
    },
    {
      "id": "thermal-radiation",
      "parentId": "incandescence",
      "type": "mechanism",
      "question": "为什么热的灯丝会发出可见光？",
      "label": "热物体的电磁辐射",
      "answer": "灯丝中的带电粒子随热运动不断加速，向外发出热辐射；温度升高后，可见波段的辐射迅速增强。",
      "summary": "热辐射不是灯丝表面“冒出”的一种特殊东西，而是带电粒子热运动产生的电磁波。温度决定辐射谱，人眼只看见其中一段。",
      "nextQuestion": "灯丝的热又是从哪里来的？",
      "knowledge": "任何温度高于绝对零度的物体都会发出热辐射。温度升高时，粒子的无规则运动更剧烈，辐射总功率按斯特藩—玻尔兹曼定律快速增长，峰值波长按维恩位移定律向短波移动。白炽灯灯丝大约工作到数千开尔文，辐射谱才明显进入可见光区；我们看到的颜色是可见波段内不同波长共同形成的。",
      "facts": [
        "所有有温度的物体都会发出热辐射。",
        "温度越高，热辐射总功率越大，峰值波长越短。",
        "人眼可见光只覆盖约 380–750 纳米的狭窄波段，因此看到的是热辐射谱的一部分。"
      ],
      "tags": [
        "热辐射",
        "可见光",
        "黑体辐射"
      ],
      "analogy": {
        "title": "拨动琴弦会让空气振动",
        "scene": "拨动琴弦，振动向周围空气传播成声音；拨得越急越有力，声音的强弱和音高也会变化。",
        "mappings": [
          {
            "familiar": "不停振动的琴弦",
            "concept": "做热运动的带电粒子"
          },
          {
            "familiar": "向四周传播的声音",
            "concept": "向外发射的电磁波"
          },
          {
            "familiar": "拨弦的剧烈程度",
            "concept": "物体温度"
          },
          {
            "familiar": "不同音高和强弱混成的音色",
            "concept": "不同波长组成的辐射谱"
          }
        ],
        "limit": "声音需要介质传播，热辐射可以在真空中传播；声音和电磁波也不是同一种波。",
        "visual": {
          "kind": "image",
          "src": "media/bulb-glow/plucked-string-analogy.svg",
          "alt": "琴弦振动并向周围发出声波",
          "caption": "振动越剧烈，向外传播的强弱和频率分布也会变化。"
        }
      },
      "visual": {
        "kind": "image",
        "src": "media/bulb-glow/thermal-radiation.svg",
        "alt": "不同温度下的热辐射谱，温度升高时峰值向短波方向移动",
        "caption": "温度升高不仅增强总辐射，也把辐射峰推向更短的波长。"
      },
      "experiment": null,
      "videoLinks": [
        {
          "id": "thermal-radiation-video-1",
          "title": "【高二物理】【必修三】22.1 热辐射、黑体及黑体辐射-锤姐物理",
          "url": "https://www.bilibili.com/video/BV1ze4y1t7hm",
          "embedUrl": "https://player.bilibili.com/player.html?bvid=BV1ze4y1t7hm&page=1&autoplay=0",
          "platform": "bilibili",
          "author": "张佳铭老师-锤姐物理",
          "thumbnailUrl": "https://i1.hdslb.com/bfs/archive/a9846b4f894ec888c6cbda3a113d1c5b10128625.jpg",
          "durationSeconds": 866,
          "publishedAt": "2022-10-01",
          "queryDate": "2026-10-26",
          "relevanceScore": 64.3,
          "selectionRationale": "系统讲解热辐射与黑体辐射，适合深入理解温度如何决定辐射谱。"
        },
        {
          "id": "thermal-radiation-video-2",
          "title": "三分钟了解黑体辐射",
          "url": "https://www.youtube.com/watch?v=Na8DULBe9xs",
          "embedUrl": "https://www.youtube-nocookie.com/embed/Na8DULBe9xs",
          "platform": "youtube",
          "author": "物理雷老师",
          "thumbnailUrl": "https://i.ytimg.com/vi/Na8DULBe9xs/hq720.jpg",
          "durationSeconds": 176,
          "publishedAt": null,
          "queryDate": "2026-10-26",
          "relevanceScore": 45.9,
          "selectionRationale": "三分钟概览黑体辐射，适合先建立直观印象后再看完整课程。"
        }
      ]
    },
    {
      "id": "joule-heating",
      "parentId": "thermal-radiation",
      "type": "mechanism",
      "question": "灯丝的热又是从哪里来的？",
      "label": "电子碰撞与焦耳热",
      "answer": "电场加速电子，电子不断与金属晶格碰撞，把定向运动获得的能量转成晶格的无序热振动。",
      "summary": "灯丝不是被火焰加热，而是电流做功。电子的定向能量在碰撞中变成大量原子的振动能量，宏观上表现为温度升高。",
      "nextQuestion": "灯丝里的电子为什么会定向移动？",
      "knowledge": "金属中的自由电子本来就在不停做无规则热运动。接通电路后，电场在电子上做功，使它们的运动叠加出一个很慢的定向漂移。电子在漂移过程中不断碰撞晶格，把从电场获得的能量交给原子振动；大量碰撞使灯丝内能上升。这个不可逆的能量转化就是焦耳热，单位时间产生的热功率可写成 P = I²R。",
      "facts": [
        "电流是电荷的定向运动，但导体中的电子仍同时保留高速的无规则热运动。",
        "电子与晶格碰撞会把电能转化为材料的内能。",
        "电阻发热功率满足 P = I²R，因此电流或电阻增大时发热更快。"
      ],
      "tags": [
        "焦耳热",
        "电子碰撞",
        "电阻"
      ],
      "analogy": {
        "title": "人群被推着挤过拥挤走廊",
        "scene": "一群人被后面持续推着穿过拥挤走廊，不断撞到立柱，整齐前进的能量逐渐变成四周的推挤和热。",
        "mappings": [
          {
            "familiar": "后面持续推人的力",
            "concept": "电场对电子的推力"
          },
          {
            "familiar": "向前移动的人群",
            "concept": "自由电子"
          },
          {
            "familiar": "走廊里的立柱",
            "concept": "金属晶格"
          },
          {
            "familiar": "碰撞后人群散乱、周围变热",
            "concept": "电子漂移能量转为晶格热振动"
          }
        ],
        "limit": "行人会主动避让；电子和晶格遵循量子规律，不能被当成有意识、会绕路的小球。",
        "visual": {
          "kind": "image",